{"document_kind":"pricing_result","schema_version":1,"value":{"value":10.0,"standard_error":0.5,"confidence_lower":9.0,"confidence_upper":11.0,"estimator":{"type":"pseudo_monte_carlo"},"effective_sampling_units":1024},"risks":{},"diagnostics":{"warnings":[{"code":"curve_extrapolation","message":"discount curve extrapolated"}]},"replay":{"schema_version":1,"request_fingerprint":"blake3-256:0000000000000000000000000000000000000000000000000000000000000000","library_version":"0.1.0","platform":"acceptance-test"}}
